{
  "id": "RUN-souffle-version",
  "title": "Soufflé 2.5: its version, the CPU architecture and a smoke program",
  "engine": "souffle",
  "version": "Version: 2.5 (2.5)",
  "binary": "/usr/bin/souffle from the 2.5 package for Ubuntu 24.04 on x86_64",
  "binary_sha256": "e8e4d8bff0b8377d2d42ae30886121a61061ec0c8bb948f1f5129e09aecfa9a1",
  "image": "ubuntu:24.04@sha256:68ee22004a9109b44973313b02ff7b1de250f1de0f5ecb628d73f579aaff33ac",
  "recorded_at": "2026-10-24T13:15:54.344Z",
  "started_at": "2026-10-24T13:15:37.721Z",
  "primary_config": "version",
  "argv": [
    "souffle",
    "--version"
  ],
  "inputs": [
    {
      "url": "https://github.com/souffle-lang/souffle/releases/download/2.5/x86_64-ubuntu-2404-souffle-2.5-Linux.deb",
      "sha256": "c7e9dd1349506bbb23c4dcf89e87396198006235f79b1cc516c0a2b67ac067bc",
      "bytes": 4759908,
      "kind": "release asset",
      "committed": false,
      "sha512": "6b86e554f6aa5abf8a8b55d8312ae37c0957c5bd6c9edeea89246db9406f645ec5e600b84fe6636b1c163da556f0da6c3d2dad46c1083413f2fcf4f95b9ac62c"
    }
  ],
  "budget": {
    "container_memory": "6g"
  },
  "exit_code": 0,
  "duration_s": 0.003,
  "verdict_lines": [
    "----------------------------------------------------------------------------",
    "Version: 2.5 (2.5)",
    "Word size: 64 bits",
    "Options enabled: ffi openmp ncurses sqlite zlib",
    "----------------------------------------------------------------------------",
    "Copyright (c) 2016-25 The Souffle Developers.",
    "Copyright (c) 2013-16 Oracle and/or its affiliates.",
    "All rights reserved.",
    "============================================================================"
  ],
  "outputs": [
    {
      "path": "runs/RUN-souffle-version/packages.txt",
      "sha256": "695d488f9a2e736678d98603ae8e4d8c277eaa679306f220fd4e56b61d7e4573",
      "bytes": 285,
      "kind": "dpkg versions",
      "compare": "informational: apt picks the newest package of the Ubuntu 24.04 archive"
    },
    {
      "path": "runs/RUN-souffle-version/release-assets.json",
      "sha256": "129fd85ab96c2fa68fbbdb9c7040ad3263530b0d6f9dad08c9cf69d606337a0c",
      "bytes": 696,
      "kind": "release asset list (GitHub API)",
      "compare": "informational: the release page can gain assets"
    }
  ],
  "values": {
    "version": "2.5",
    "cpu_architecture": "x86_64",
    "dpkg_architecture": "amd64",
    "word_size": 64,
    "options_enabled": "ffi openmp ncurses sqlite zlib",
    "deb_sha256": "c7e9dd1349506bbb23c4dcf89e87396198006235f79b1cc516c0a2b67ac067bc",
    "deb_sha512": "6b86e554f6aa5abf8a8b55d8312ae37c0957c5bd6c9edeea89246db9406f645ec5e600b84fe6636b1c163da556f0da6c3d2dad46c1083413f2fcf4f95b9ac62c",
    "control": [
      "Architecture: amd64",
      "Package: souffle",
      "Version: 2.5"
    ],
    "smoke_tuples": 6
  },
  "environment": {
    "os": "Linux 6.12.63 x86_64",
    "cpu_count": 20,
    "ram_gib": 31,
    "container": {
      "runtime": "docker",
      "server_version": "29.1.3",
      "image": "ubuntu:24.04",
      "digest": "sha256:68ee22004a9109b44973313b02ff7b1de250f1de0f5ecb628d73f579aaff33ac",
      "architecture": "amd64",
      "run_flags": [
        "--rm",
        "--memory=6g",
        "-v <mount>:/work:ro"
      ],
      "network": "bridge, for apt only"
    },
    "host_tools": {
      "node": "v22.22.2",
      "uv": "uv 0.10.2"
    },
    "emulated": false,
    "cpu_architecture": "x86_64"
  },
  "notes": [
    "Soufflé 2.5 is the Datalog reference for S7 (spine section 9.2). The 2.5 release lists 6 packages (release-assets.json): x86_64-fedora-39-souffle-2.5-Linux.rpm, x86_64-fedora-40-souffle-2.5-Linux.rpm, x86_64-fedora-41-souffle-2.5-Linux.rpm, x86_64-oraclelinux-9-souffle-2.5-Linux.rpm, x86_64-ubuntu-2204-souffle-2.5-Linux.deb, x86_64-ubuntu-2404-souffle-2.5-Linux.deb. Every one is x86_64; there is no arm64 package, so a learner on an arm64 devcontainer (Apple silicon under Docker) builds from source. Upstream issue #2476, sporadic crashes on ARM, was open when labs/TOOLS.md section 2.7 last read it [V], so a receipt records the CPU architecture (spine section 9.2).",
    "binary_sha256 is the SHA-256 of /usr/bin/souffle after apt installed the package; the package is the input, pinned by its SHA-256 and checked against the SHA-512 in the release's sha512sum.txt.",
    "The package depends on g++, python3, libffi-dev, libsqlite3-dev and mcpp, because Soufflé's compile mode needs a C++ compiler; the interpreter used by the smoke run needs none of them. The Bench image should decide whether it ships them (W0-T05).",
    "This run needed the network once, for apt. The versions apt chose are in packages.txt; they come from the Ubuntu 24.04 archive of the day, so a re-run may differ there and must not differ in verdict_lines.",
    "The smoke program is transitive closure over edges 1-2, 2-3, 3-4: six tuples. The record shows the tool runs on this architecture; the equal-relations comparison with Z3 Fixedpoint is W0-S03's."
  ],
  "configs": [
    {
      "id": "version",
      "purpose": "the version banner of the pinned release on the recorded CPU architecture",
      "engine": "souffle",
      "version": "Version: 2.5 (2.5)",
      "binary_sha256": "e8e4d8bff0b8377d2d42ae30886121a61061ec0c8bb948f1f5129e09aecfa9a1",
      "argv": [
        "souffle",
        "--version"
      ],
      "inputs": [
        {
          "url": "https://github.com/souffle-lang/souffle/releases/download/2.5/x86_64-ubuntu-2404-souffle-2.5-Linux.deb",
          "sha256": "c7e9dd1349506bbb23c4dcf89e87396198006235f79b1cc516c0a2b67ac067bc",
          "bytes": 4759908,
          "kind": "release asset",
          "committed": false,
          "sha512": "6b86e554f6aa5abf8a8b55d8312ae37c0957c5bd6c9edeea89246db9406f645ec5e600b84fe6636b1c163da556f0da6c3d2dad46c1083413f2fcf4f95b9ac62c"
        }
      ],
      "budget": {
        "container_memory": "6g"
      },
      "started_at": "2026-10-24T13:15:37.721Z",
      "duration_s": 0.003,
      "exit_code": 0,
      "verdict_lines": [
        "----------------------------------------------------------------------------",
        "Version: 2.5 (2.5)",
        "Word size: 64 bits",
        "Options enabled: ffi openmp ncurses sqlite zlib",
        "----------------------------------------------------------------------------",
        "Copyright (c) 2016-25 The Souffle Developers.",
        "Copyright (c) 2013-16 Oracle and/or its affiliates.",
        "All rights reserved.",
        "============================================================================"
      ],
      "outputs": [
        {
          "path": "runs/RUN-souffle-version/packages.txt",
          "sha256": "695d488f9a2e736678d98603ae8e4d8c277eaa679306f220fd4e56b61d7e4573",
          "bytes": 285,
          "kind": "dpkg versions",
          "compare": "informational: apt picks the newest package of the Ubuntu 24.04 archive"
        },
        {
          "path": "runs/RUN-souffle-version/release-assets.json",
          "sha256": "129fd85ab96c2fa68fbbdb9c7040ad3263530b0d6f9dad08c9cf69d606337a0c",
          "bytes": 696,
          "kind": "release asset list (GitHub API)",
          "compare": "informational: the release page can gain assets"
        }
      ],
      "cpu_architecture": {
        "uname_m": "x86_64",
        "dpkg": "amd64"
      }
    },
    {
      "id": "smoke",
      "purpose": "a transitive closure over three edges, evaluated by the interpreter",
      "engine": "souffle",
      "version": "Version: 2.5 (2.5)",
      "binary_sha256": "e8e4d8bff0b8377d2d42ae30886121a61061ec0c8bb948f1f5129e09aecfa9a1",
      "argv": [
        "souffle",
        "-D-",
        "/work/tc.dl"
      ],
      "inputs": [
        {
          "url": "https://github.com/souffle-lang/souffle/releases/download/2.5/x86_64-ubuntu-2404-souffle-2.5-Linux.deb",
          "sha256": "c7e9dd1349506bbb23c4dcf89e87396198006235f79b1cc516c0a2b67ac067bc",
          "bytes": 4759908,
          "kind": "release asset",
          "committed": false,
          "sha512": "6b86e554f6aa5abf8a8b55d8312ae37c0957c5bd6c9edeea89246db9406f645ec5e600b84fe6636b1c163da556f0da6c3d2dad46c1083413f2fcf4f95b9ac62c"
        },
        {
          "path": "runs/RUN-souffle-version/smoke/tc.dl",
          "sha256": "8d3d54d75cbc6675d198ee83fe6e38f27e049f01b0bb93e41141b07e0a09023b",
          "bytes": 190
        }
      ],
      "budget": {
        "container_memory": "6g"
      },
      "started_at": "2026-10-24T13:15:37.721Z",
      "duration_s": 0.005,
      "exit_code": 0,
      "verdict_lines": [
        "---------------",
        "path",
        "a\tb",
        "===============",
        "1\t2",
        "1\t3",
        "1\t4",
        "2\t3",
        "2\t4",
        "3\t4",
        "==============="
      ],
      "outputs": []
    }
  ]
}
